{
  "schema_version": 2,
  "schema_id": "visloc-rs.basalt.provenance.v2",
  "manifest_id": "basalt-provenance-v2-frozen",
  "captured_at": "2026-08-31T09:30:00+09:00",
  "status": "frozen",
  "supersedes": {
    "path": "benchmarks/basalt/basalt_provenance_manifest_v1.json",
    "bytes": 46494,
    "sha256": "76c08147035efaccffa9abeec6bd80d8a9f75d46a0e5331231d43ce8b747c513",
    "schema_id": "visloc-rs.basalt.provenance.v1",
    "immutable": true,
    "retained_sections": [
      "upstreams",
      "vcpkg_resolution",
      "m7im_verification",
      "current_metadata",
      "release"
    ],
    "policy": "v1 and its M1/M7 records remain historical; v2 never rewrites them"
  },
  "upstream_identity": {
    "commit": "0f3b2b52c807f70ff4e2973ce253c73329eea7bc",
    "tree_sha1": "b7afb830d82b45b8209cf784ad9744025d838411",
    "license_spdx": "BSD-3-Clause",
    "vcpkg": {
      "repository": "https://github.com/microsoft/vcpkg.git",
      "commit": "1e199d32ad53aab1defda61ce41c380302e3f95c",
      "baseline": "05442024c3fda64320bd25d2251cc9807b84fb6f",
      "overlay_ports": {
        "basalt-headers": "aa441ba3e51050c47ba1902537792a2e4db7e43d",
        "opengv": "91f4b19c73450833a40e463ad3648aae80b3a7f3"
      },
      "registry_ports": {
        "eigen3": "5.0.1",
        "opencv4": "4.12.0#1",
        "sophus": "1.24.6"
      },
      "port_patches": {
        "opencv4": [
          "468de9b36740b3355f0d5cd8be2ce28b340df120.patch"
        ],
        "sophus": [
          "0001-support-eigen3-5.patch"
        ],
        "opengv": [
          "CMake C++17/configuration substitutions in the pinned overlay port",
          "FindEigen CONFIG shim in the pinned overlay port"
        ]
      },
      "source_ref_policy": "Registry versions are resolved to immutable upstream tag commits above; the vcpkg baseline and overlay port commit remain the reproducible package-resolution anchors."
    }
  },
  "current_binding": {
    "source": {
      "root": "pipelines/basalt/src",
      "file_count": 33,
      "hash_algorithm": "sha256",
      "hash_basis": "exact checked-out bytes; no line-ending normalization",
      "canonical_record": "relative POSIX path|lowercase SHA256, newline-joined and sorted",
      "source_tree_sha256": "bf62dbae9df31a69232aaa8cc8ee54a5c5bfdff34e634c572113d86601e72622",
      "files": [
        {
          "path": "pipelines/basalt/src/adapter.rs",
          "bytes": 13188,
          "sha256": "b3261499b12213db7f03d480ba69cba9d0faafcf5ef9080a34c729384d319e2c",
          "role": "production_rust"
        },
        {
          "path": "pipelines/basalt/src/calibration.rs",
          "bytes": 10719,
          "sha256": "80aeddbda130764f8abe1624fa6f46e7f8c1834c166e5d61ccdffcafd75951e9",
          "role": "production_rust"
        },
        {
          "path": "pipelines/basalt/src/camera.rs",
          "bytes": 13288,
          "sha256": "e04af476c09f33fc499d2987a3505017c7b96f941bc2bc2c609bfd48fd754eba",
          "role": "production_rust"
        },
        {
          "path": "pipelines/basalt/src/config.rs",
          "bytes": 7564,
          "sha256": "3fd39df6ce50bdc935d8e4744031bc67d2aa0ad57faf2c87e81b179c6dcee037",
          "role": "production_rust"
        },
        {
          "path": "pipelines/basalt/src/euroc.rs",
          "bytes": 22661,
          "sha256": "d4773ada60baefab6190c0bd45af8610f78ad0e0e640d402ccf59be6f4ac270b",
          "role": "production_rust"
        },
        {
          "path": "pipelines/basalt/src/fast.rs",
          "bytes": 19170,
          "sha256": "2255c1fc81fdb025cdd289f7edc98157c97ec1cf4012ffa8a2594d211c25d085",
          "role": "production_rust"
        },
        {
          "path": "pipelines/basalt/src/imu/factors.rs",
          "bytes": 129360,
          "sha256": "b53604638fe0dcc68c5500cd7b7cdde306258ba787438e42c6898a14c857d95f",
          "role": "production_rust"
        },
        {
          "path": "pipelines/basalt/src/imu/mod.rs",
          "bytes": 1081,
          "sha256": "6de279bb0774e5e58b09c3283cdc7ee0bed7fe73158e701a26d7f41b2c5e8680",
          "role": "production_rust"
        },
        {
          "path": "pipelines/basalt/src/imu/preintegration.rs",
          "bytes": 18789,
          "sha256": "563099ea23a2f63d13ac66138bf6e5b07c0bab098aa14224023479d72bf6e9f7",
          "role": "production_rust"
        },
        {
          "path": "pipelines/basalt/src/imu/sampling.rs",
          "bytes": 3020,
          "sha256": "87d89f0ee1e07518951e35e7edc19f5ffe1b069e5c5a46a61493819021597c87",
          "role": "production_rust"
        },
        {
          "path": "pipelines/basalt/src/initialization.rs",
          "bytes": 6169,
          "sha256": "cb76498fe1ade7e8788b6870ebb2faeec02fdc7f817b6ec38352c0de6d4eb1c3",
          "role": "production_rust"
        },
        {
          "path": "pipelines/basalt/src/lib.rs",
          "bytes": 2351,
          "sha256": "2ee7de94a3de7644ff840f0ab8c13fb9b633993688d7af829650115a7b83a42e",
          "role": "production_rust"
        },
        {
          "path": "pipelines/basalt/src/mapper/features.rs",
          "bytes": 95616,
          "sha256": "e74dc6e395336aca9a975ffc0ba63b070af12d2c24b8d723e935ba97b830f60a",
          "role": "production_rust"
        },
        {
          "path": "pipelines/basalt/src/mapper/mod.rs",
          "bytes": 136245,
          "sha256": "dd7b38c46bb829692c76c7abd17b1eceb66d102453fb820f7794bbe36901f181",
          "role": "production_rust"
        },
        {
          "path": "pipelines/basalt/src/mapper/session.rs",
          "bytes": 86477,
          "sha256": "247401d17669c63459de727a9ea5c10578025681c3235f9e1823414cc655102d",
          "role": "production_rust"
        },
        {
          "path": "pipelines/basalt/src/mapper/triangulation.rs",
          "bytes": 33333,
          "sha256": "536d64d4ca6552b558c714f90de2e07e24ba5f3d1634ea2dd57df5eb8cdf53e4",
          "role": "production_rust"
        },
        {
          "path": "pipelines/basalt/src/patch.rs",
          "bytes": 31758,
          "sha256": "881b7a78c6a215536b235c82c6bf7ef158e737250f7bc2597b467206e71e19b2",
          "role": "production_rust"
        },
        {
          "path": "pipelines/basalt/src/pattern.rs",
          "bytes": 2029,
          "sha256": "e0bea281b6a62266441d1a6633b5b014c1d382dda81f5bd0e1b323b472fe812d",
          "role": "production_rust"
        },
        {
          "path": "pipelines/basalt/src/provenance.rs",
          "bytes": 1349,
          "sha256": "f52ab64c1f398612862d03db2d557fa390108a2656814bce6acb664f1979e7bb",
          "role": "production_rust"
        },
        {
          "path": "pipelines/basalt/src/pyramid.rs",
          "bytes": 13124,
          "sha256": "ef63434ceb0b3ef9ae4740efaa08af5e878ae0bd44a30eb0f4a5ac9c91d016b9",
          "role": "production_rust"
        },
        {
          "path": "pipelines/basalt/src/stream.rs",
          "bytes": 26589,
          "sha256": "d0a48e28fbc5b6cd76211abdd75ba348d8dbf5cd663a8001b93ef141f770e6b7",
          "role": "production_rust"
        },
        {
          "path": "pipelines/basalt/src/streaming.rs",
          "bytes": 7086,
          "sha256": "f059bd245b393847e83453e8a02742d91f27e00c4b8bb8a3834615184d0c0106",
          "role": "production_rust"
        },
        {
          "path": "pipelines/basalt/src/time.rs",
          "bytes": 5774,
          "sha256": "3a11d726721a57eb7b16564cebe68dfb0ebe9b7286ed47ffec84cb7ee2ac035a",
          "role": "production_rust"
        },
        {
          "path": "pipelines/basalt/src/timing.rs",
          "bytes": 34793,
          "sha256": "320294ad25ca3b036e42148f8c53e819ac8fac8c21151bde96e69c6d4a57c5be",
          "role": "production_rust"
        },
        {
          "path": "pipelines/basalt/src/types.rs",
          "bytes": 3201,
          "sha256": "674501a2997502dea838ce9aaf5dd141bfb98d5d7621b95fa387a94f92ada137",
          "role": "production_rust"
        },
        {
          "path": "pipelines/basalt/src/update.rs",
          "bytes": 11853,
          "sha256": "00a9d573fddf52cf159cbceccab15dcc1a25198b75bf41e09a3e942e2ba61378",
          "role": "production_rust"
        },
        {
          "path": "pipelines/basalt/src/vio/aom.rs",
          "bytes": 692013,
          "sha256": "246979610f9c6537311ac1d3e94f611ce6f7efdf265d357ba3cbc6588a1c9667",
          "role": "production_rust"
        },
        {
          "path": "pipelines/basalt/src/vio/estimator.rs",
          "bytes": 196458,
          "sha256": "a43eaa12e79eefbb3a87f2a05354032e981296d8f124cf5a52f60a77ad71b45d",
          "role": "production_rust"
        },
        {
          "path": "pipelines/basalt/src/vio/landmarks.rs",
          "bytes": 83038,
          "sha256": "5eab7c4749ab92bdec249cf5e9a354cfabd66cfafbc2b328b1cd4d1fa765c831",
          "role": "production_rust"
        },
        {
          "path": "pipelines/basalt/src/vio/margdata.rs",
          "bytes": 52986,
          "sha256": "060f18dc1f81ac0a3603e41340647e41c25a4ec7a5a5e007e0e1c3701aaa1274",
          "role": "production_rust"
        },
        {
          "path": "pipelines/basalt/src/vio/mod.rs",
          "bytes": 387,
          "sha256": "032f39f9977ce483a468bae63f4acd88c3ce4c485bdc12928e2917e8664c5742",
          "role": "production_rust"
        },
        {
          "path": "pipelines/basalt/src/vio/scalar.rs",
          "bytes": 839,
          "sha256": "fd88e98c2e7b18e65c03dad2463aab423d44919f68754ee9a1d7f6ccea20a199",
          "role": "production_rust"
        },
        {
          "path": "pipelines/basalt/src/vio/window.rs",
          "bytes": 436210,
          "sha256": "9facfcbfe0b76b29f764265ea90104699a0af82b293906c9d9baac43bfae36c0",
          "role": "production_rust"
        }
      ]
    },
    "tests": {
      "root": "pipelines/basalt/tests",
      "file_count": 44,
      "hash_algorithm": "sha256",
      "hash_basis": "exact checked-out bytes; no line-ending normalization",